{
  "access_protocol": {
    "kubernetes": [
      {
        "source": "target:kubernetes.kubeconfigs",
        "when": "the target declares kubectl's ordered, combined path"
      },
      {
        "source": "target:kubernetes.kubeconfig",
        "when": "the target declares one file"
      },
      {
        "source": "binding:path:10db39953fa9",
        "when": "a project binding selects a declared file, environment, or command source"
      },
      {
        "source": "env:KUBECONFIG",
        "when": "set; its path order is honoured"
      },
      {
        "source": "kubectl-default:~/.kube/config",
        "when": "nothing above applies"
      }
    ]
  },
  "capabilities": [],
  "command": "ocp_node_onboard.py",
  "default_output": "json when stdout is not a terminal, human when it is",
  "description": "Build requires --destination and exactly one of --mac-address or --spec. The caller selects real NIC/network/disk values; ci-skills passes native YAML unchanged to OpenShift and returns native errors. Tools are prepared inside the Pod through CI12.0. The destination wrapper selects storage and an exact final path; it does not define an OCP schema. Native input and destination examples: references/ocp-node-image.md.",
  "examples": [
    {
      "command": "ocp_node_onboard.py build --mac-address 02:00:00:10:00:01 --destination destination.json --live-plan --json",
      "description": "Plan a MAC-based build at the selected cluster destination"
    },
    {
      "command": "ocp_node_onboard.py build --spec nodes-config.yaml --destination destination.json --live-plan --json",
      "description": "Plan a build from the caller's unchanged native YAML"
    },
    {
      "command": "ocp_node_onboard.py build --spec nodes-config.yaml --destination destination.json --apply --confirm-plan DIGEST --json",
      "description": "Build from the same inputs after inspecting the plan"
    },
    {
      "command": "ocp_node_onboard.py verify --run-id RUN_ID --json",
      "description": "Inspect a previous run's cluster-held artifact"
    },
    {
      "command": "ocp_node_onboard.py remove --run-id RUN_ID --live-plan --json",
      "description": "Plan removal while preserving persistent output"
    }
  ],
  "execution_surface": "installed skill controls tools and ISO generation inside the selected Kubernetes cluster",
  "exit_codes": {
    "0": "PASS, DRY_RUN, or a live read-only PLANNED result",
    "2": "BLOCKED or PARTIAL, or an input that could not be used"
  },
  "kind": "command_contract",
  "mutates": true,
  "options": {
    "--apply": "perform the exact confirmed build or removal",
    "--binding": "project-declared target and ordered kubeconfig source resolver",
    "--confirm-plan": "plan digest binding target, native inputs, storage, tools and functional code",
    "--describe": "this command's machine-readable contract, then exit",
    "--destination": "five-field cluster storage JSON; schemas/artifact-destination.schema.json",
    "--dry-run": "list planned probes without contacting any API; never access evidence",
    "--human": "human summary even when stdout is not a terminal",
    "--json": "versioned JSON document",
    "--live-plan": "resolve live prerequisites and produce the confirmation digest",
    "--log-file": "also append sanitized diagnostics to this exact path",
    "--log-format": "diagnostic log format: text or JSON Lines (default: text)",
    "--log-level": "minimum diagnostic level: debug, info, warning, or error",
    "--mac-address": "joining host's actual NIC MAC; alternative to --spec",
    "--network-config-path": "native network YAML used with the MAC route, passed unchanged",
    "--output-dir": "write paired JSON and text reports to this explicit path",
    "--pull-secret-key": "[REDACTED]",
    "--pull-secret-name": "[REDACTED]",
    "--pull-secret-namespace": "[REDACTED]",
    "--receipt-out": "write the sanitized result to this exact path",
    "--revision": "exact source commit of the installed copy, recorded as a claim",
    "--run-id": "returned run identifier for verification/removal, also used in logs",
    "--spec": "native nodes-config.yaml passed unchanged; alternative to --mac-address",
    "--timeout": "positive operation timeout in seconds (default: 1800)",
    "--tool-pod-spec": "optional CI12.0 tool override; schemas/tool-pod.schema.json",
    "--yaml": "versioned YAML document"
  },
  "purpose": "Build an OpenShift node ISO in-cluster and verify its delivery to selected storage.",
  "report_kind": "ocp_node_onboard",
  "required_options": [],
  "required_tools": [
    "kubectl",
    "oc",
    "curl (default tool discovery)"
  ],
  "requires_authorities": [
    "kubernetes"
  ],
  "returns": "Shared workflow report with native completion, callback observations, final cluster artifact identity/lifetime, plan, provenance and cleanup evidence.",
  "schema_version": "1.0",
  "side_effects": "Build/remove use plan confirmation. Native oc creates its temporary workload and RBAC; the wrapper grants no additional cluster rights. ISO bytes stay in the cluster.",
  "skill": "ci-skills",
  "status_values": {
    "BLOCKED": "an authority or a required read failed; see blocking_live_checks",
    "DRY_RUN": "a probe plan only, never access evidence",
    "PARTIAL": "the read completed and a component is unhealthy; see access_proven",
    "PASS": "every selected authority and live check passed",
    "PLANNED": "a live read-only operation plan, with no resource mutation",
    "UNKNOWN": "a per-item reading could not be taken, preserved rather than coerced"
  },
  "subcommands": {
    "build": {
      "mutates": true,
      "purpose": "Build from either a MAC or native YAML and verify the exact cluster destination.",
      "read_back": "Native completion, embedded Ignition, actual ISO size/SHA-256 and destination.",
      "required_options": [
        "--destination"
      ],
      "result_schema": "schemas/results/ocp-node-onboard.schema.json",
      "side_effects": "Confirmed build stages a tool Pod and native OpenShift temporary resources, writes the requested ISO, and retains its run record; temporary final storage retains its Pod."
    },
    "remove": {
      "mutates": true,
      "purpose": "Remove owned run resources while preserving persistent destination storage and ISO.",
      "read_back": "Owned resource absence and, for persistent output, unchanged ISO before and after removal.",
      "required_options": [
        "--run-id"
      ],
      "result_schema": "schemas/results/ocp-node-onboard.schema.json",
      "side_effects": "Confirmed removal deletes only run-owned resources; temporary output ends with its Pod. Persistent ISO and caller storage remain."
    },
    "verify": {
      "mutates": true,
      "purpose": "Read and inspect the existing cluster-held ISO identified by its run.",
      "read_back": "Exact stored artifact identity, size/SHA-256 and embedded Ignition.",
      "required_options": [
        "--run-id"
      ],
      "result_schema": "schemas/results/ocp-node-onboard.schema.json",
      "side_effects": "Persistent storage can require a temporary reader Pod, cleaned after inspection."
    }
  },
  "target_protocol": [
    {
      "location": "$CI_SKILLS_TARGET",
      "scope": "one environment",
      "source": "env:CI_SKILLS_TARGET",
      "when": "set; a missing file is an error, never a fallback"
    },
    {
      "location": "./.ci-skills/target.toml",
      "scope": "one project",
      "source": "project",
      "when": "present in the working directory; ci-skills-smoke selects ci-skills-smoke.toml instead"
    },
    {
      "location": "~/.ci-skills/target.toml",
      "scope": "one user",
      "source": "user",
      "when": "present; ci-skills-smoke selects ci-skills-smoke.toml instead, without normal-target fallback"
    }
  ],
  "use_when": "Prepare a node boot image from the caller's native MAC or YAML input; inspect or release a previous run. See references/ocp-node-image.md."
}
